Title,URL
AI overly affirms users asking for personal advice (stanford.edu),https://news.stanford.edu/stories/2026/03/ai-advice-sycophantic-models-research
"Further human + AI + proof assistant work on Knuth's ""Claude Cycles"" problem (twitter.com/bowang87)",https://twitter.com/BoWang87/status/2037648937453232504
The first 40 months of the AI era (lzon.ca),https://lzon.ca/posts/other/thoughts-ai-era/
What if AI doesn't need more RAM but better math? (adlrocha.substack.com),https://adlrocha.substack.com/p/adlrocha-what-if-ai-doesnt-need-more
InpharmD (YC W21) Is Hiring – Senior Ruby on Rails Developer (inpharmd.com),https://inpharmd.com/jobs/senior-ruby-on-rails-engineer
Modeling what makes paper-folding puzzles hard (dailyunfold.com),https://www.dailyunfold.com/blog/spatial-difficulty
