Title,URL
"Agents can now create Cloudflare accounts, buy domains, and deploy (cloudflare.com)",https://blog.cloudflare.com/agents-stripe-projects/
DNSSEC disruption affecting .de domains – Resolved (denic.de),https://status.denic.de/pages/incident/592577eab611ce1e0d00046f/69fa60ef9d12f5057a974f38
Telus Uses AI to Alter Call-Agent Accents (letsdatascience.com),https://letsdatascience.com/news/telus-uses-ai-to-alter-call-agent-accents-a3868f63
Three Inverse Laws of AI (susam.net),https://susam.net/inverse-laws-of-robotics.html
Behavior-Oriented Concurrency for Python (microsoft.github.io),https://microsoft.github.io/bocpy/
Wiki Builder: Skill to Build LLM Knowledge Bases (dair.ai),https://academy.dair.ai/blog/wiki-builder-claude-code-plugin
Google Chrome silently installs a 4 GB AI model on your device without consent (thatprivacyguy.com),https://www.thatprivacyguy.com/blog/chrome-silent-nano-install/
Show HN: Airbyte Agents – context for agents across multiple data sources,item?id=48023496
Show HN: Explore color palettes inspired by 3000 master painter artworks (paletteinspiration.com),https://paletteinspiration.com/
