Title,URL
Google details new 24-hour process to sideload unverified Android apps (arstechnica.com),https://arstechnica.com/gadgets/2026/03/google-details-new-24-hour-process-to-sideload-unverified-android-apps/
Astral to Join OpenAI (astral.sh),https://astral.sh/blog/openai
Launch HN: Voltair (YC W26) – Drone and charging network for power utilities,item?id=47442452
Be intentional about how AI changes your codebase (swerdlow.dev),https://aicode.swerdlow.dev
Launch HN: Canary (YC W26) – AI QA that understands your code,item?id=47441629
