Title,URL
ClojureScript Gets Async/Await (clojurescript.org),https://clojurescript.org/news/2026-05-07-release
Blaise – A modern self-hosting zero-legacy Object Pascal compiler targeting QBE (github.com/graemeg),https://github.com/graemeg/blaise
AI slop is killing online communities (rmoff.net),https://rmoff.net/2026/05/06/ai-slop-is-killing-online-communities/
Two Home Affairs officials suspended after AI 'hallucinations' found (citizen.co.za),https://www.citizen.co.za/news/home-affairs-officials-suspended-ai-hallucinations/
GPT-5.5 Price Increase: What It Costs (openrouter.ai),https://openrouter.ai/announcements/gpt55-cost-analysis
