Title,URL
Stop Sloppypasta (stopsloppypasta.ai),https://stopsloppypasta.ai/
Glassworm is back: A new wave of invisible Unicode attacks hits repositories (aikido.dev),https://www.aikido.dev/blog/glassworm-returns-unicode-attack-github-npm-vscode
SpiceCrypt: A Python library for decrypting LTspice encrypted model files (github.com/jtsylve),https://github.com/jtsylve/spice-crypt
A new Bigfoot documentary helps explain our conspiracy-minded era (msn.com),https://www.msn.com/en-us/news/us/a-new-bigfoot-documentary-helps-explain-our-conspiracy-minded-era/ar-AA1Yv6px
Cannabinoids remove plaque-forming Alzheimer's proteins from brain cells (2016) (salk.edu),https://www.salk.edu/news-release/cannabinoids-remove-plaque-forming-alzheimers-proteins-from-brain-cells/
